{
  "alpha_id": "EQ03",
  "created_ts": 1787691480577291027,
  "dataset_version": "116b77873de422ddd3b4f875625a0d8bba7dc2850068aae6ed807e944fb34573",
  "experiment_id": "838e0c2d75de4db6",
  "feature_version": "585dd7b92b738f9da7df863dba1ac049ff10b75b60a8559baac1e49b6f3062ac",
  "fold_consistency": 1.0,
  "git_commit": "53ba75d392b65a80dbcd499c8a846a2598cf9998",
  "gross_return_bps": 0.0,
  "hit_rate": 0.5404814004376368,
  "hypothesis_sign_confirmed": true,
  "ic": 0.016719072889193644,
  "leakage_detail": {
    "ic_shifted": 0.011591399921638242,
    "ic_unshifted": 0.009393433900149876,
    "label_guard_ok": true,
    "median_row_gap_ns": 2150437746,
    "passed": true,
    "recompute_mismatches": [],
    "recompute_n_anchors": 3,
    "recompute_ok": true,
    "required_shift_ratio": 0.0,
    "shift_ok": true,
    "suspicious_ic": 0.03,
    "truncation_ok": true
  },
  "leakage_passed": true,
  "max_drawdown_bps": 0.0,
  "model_version": "b63867f3c6ac0d050bf6f5d54d0cc610d899139f46242395a91144885765d2b9",
  "n_experiments_in_ledger": 5156,
  "n_folds": 4,
  "net_return_bps": 0.0,
  "nw_lags": 2,
  "rank_ic": 0.023176831690078257,
  "sharpe": 0.0,
  "t_stat": 2.982251004936631,
  "transaction_cost_bps": 0.0,
  "turnover": 425.01703699049835,
  "verdict": "ITERATE"
}
