{
  "alpha_id": "EQ01",
  "created_ts": 1787691480577291027,
  "dataset_version": "116b77873de422ddd3b4f875625a0d8bba7dc2850068aae6ed807e944fb34573",
  "experiment_id": "6e4a3431a3acf8a5",
  "feature_version": "585dd7b92b738f9da7df863dba1ac049ff10b75b60a8559baac1e49b6f3062ac",
  "fold_consistency": 1.0,
  "git_commit": "ab90995bfb2fb866e4f77ff7da9d98d72a23801f",
  "gross_return_bps": 0.0,
  "hit_rate": 0.5659760087241004,
  "hypothesis_sign_confirmed": true,
  "ic": 0.018690003501004568,
  "leakage_detail": {
    "ic_shifted": 0.006139213987389191,
    "ic_time_shifted": -0.017762591048450616,
    "ic_unshifted": -0.000976544357604662,
    "label_guard_ok": true,
    "median_row_gap_ns": 2150437746,
    "passed": true,
    "recompute_mismatches": [],
    "recompute_n_anchors": 3,
    "recompute_ok": true,
    "required_shift_ratio": 0.0,
    "required_time_shift_ratio": 0.313736481,
    "shift_ok": true,
    "suspicious_ic": 0.03,
    "time_shift_lag_ns": 250000000,
    "time_shift_ok": true,
    "time_shift_pairs": 1353,
    "truncation_ok": true
  },
  "leakage_passed": true,
  "max_drawdown_bps": 0.0,
  "model_version": "995362d0c53e541bd1f9db90c65ef1cb32e34e98dbb7e9afb121925d2db6625d",
  "n_experiments_in_ledger": 5361,
  "n_folds": 4,
  "net_return_bps": 0.0,
  "nw_lags": 3,
  "rank_ic": 0.03272390567952616,
  "sharpe": 0.0,
  "t_stat": 2.969940719154151,
  "transaction_cost_bps": 0.0,
  "turnover": 96.36706551075116,
  "verdict": "ITERATE"
}
