{
  "alpha_id": "EQ03",
  "created_ts": 1787691480577291027,
  "dataset_version": "116b77873de422ddd3b4f875625a0d8bba7dc2850068aae6ed807e944fb34573",
  "experiment_id": "f0f6c49b553f6b59",
  "feature_version": "585dd7b92b738f9da7df863dba1ac049ff10b75b60a8559baac1e49b6f3062ac",
  "fold_consistency": 1.0,
  "git_commit": "29f0822534e3c6d74e09cbe393d5d58e6edf4919",
  "gross_return_bps": 12.419190200750013,
  "hit_rate": 0.5196772600032933,
  "hypothesis_sign_confirmed": true,
  "ic": 0.027113856402183976,
  "leakage_detail": {
    "ic_shifted": 0.014955045942139216,
    "ic_unshifted": 0.01863057771792065,
    "label_guard_ok": true,
    "median_row_gap_ns": 2150437746,
    "passed": true,
    "required_shift_ratio": 0.2849562254,
    "shift_ok": true,
    "suspicious_ic": 0.03,
    "truncation_ok": true
  },
  "leakage_passed": true,
  "max_drawdown_bps": 2169.638645626228,
  "model_version": "f02f49dd0daef381be157888951293578edf1f07b56d5c8cff32a36002e06a2c",
  "n_experiments_in_ledger": 1852,
  "n_folds": 4,
  "net_return_bps": -2174.726246749237,
  "nw_lags": 2,
  "rank_ic": 0.02874513045729089,
  "sharpe": -1147.9991498558907,
  "t_stat": 4.840457403724201,
  "transaction_cost_bps": 2187.145436949987,
  "turnover": 436.59103780552925,
  "verdict": "ITERATE"
}
