{
  "alpha_id": "EQ06",
  "created_ts": 1787691480577291027,
  "dataset_version": "203c8f540f75de984fa80f5ec9c04a91a1252819586a9fca6d48483f1462e67b",
  "experiment_id": "d0dd1ab0711d33a1",
  "feature_version": "585dd7b92b738f9da7df863dba1ac049ff10b75b60a8559baac1e49b6f3062ac",
  "fold_consistency": 1.0,
  "git_commit": "fc41ac6f1381cc88d235fa206ba94f7bd104d469",
  "gross_return_bps": 11.483497788364106,
  "hit_rate": 0.543306448344344,
  "hypothesis_sign_confirmed": true,
  "ic": 0.05047487089463795,
  "leakage_detail": {
    "ic_shifted": 0.06002310045065769,
    "ic_unshifted": 0.04048328321715036,
    "label_guard_ok": true,
    "median_row_gap_ns": 982417950,
    "passed": true,
    "required_shift_ratio": 0.4508791025,
    "shift_ok": true,
    "suspicious_ic": 0.03,
    "truncation_ok": true
  },
  "leakage_passed": true,
  "max_drawdown_bps": 531.1168983974559,
  "model_version": "fad2af862625cbd16569ae8d4092cf85705dc9ba8983f1e8d0a804059fc177ff",
  "n_experiments_in_ledger": 1068,
  "n_folds": 4,
  "net_return_bps": -531.1168983974585,
  "nw_lags": 2,
  "rank_ic": 0.0786088906827771,
  "sharpe": -896.5425159772741,
  "t_stat": 6.755084976776064,
  "transaction_cost_bps": 542.6003961858227,
  "turnover": 258.8929856888763,
  "verdict": "ITERATE"
}
